DEVICE ID 1ea7:0066 on Bus 001 Address 001 =================
 bLength                :   0x12 (18 bytes)
 bDescriptorType        :    0x1 Device
 bcdUSB                 :  0x110 USB 1.1
 bDeviceClass           :    0x0 Specified at interface     
 bDeviceSubClass        :    0x0
 bDeviceProtocol        :    0x0
 bMaxPacketSize0        :    0x8 (8 bytes)
 idVendor               : 0x1ea7
 idProduct              : 0x0066
 bcdDevice              :  0x200 Device 2.0
 iManufacturer          :    0x0 
 iProduct               :    0x1 2.4G Mouse
 iSerialNumber          :    0x0 
 bNumConfigurations     :    0x1
  CONFIGURATION 1: 100 mA ==================================
   bLength              :    0x9 (9 bytes)
   bDescriptorType      :    0x2 Configuration
   wTotalLength         :   0x3b (59 bytes)
   bNumInterfaces       :    0x2
   bConfigurationValue  :    0x1
   iConfiguration       :    0x0 
   bmAttributes         :   0xa0 Bus Powered, Remote Wakeup 
   bMaxPower            :   0x32 (100 mA)
    INTERFACE 0: Human Interface Device ====================
     bLength            :    0x9 (9 bytes)
     bDescriptorType    :    0x4 Interface
     bInterfaceNumber   :    0x0
     bAlternateSetting  :    0x0
     bNumEndpoints      :    0x1
     bInterfaceClass    :    0x3 Human Interface Device
     bInterfaceSubClass :    0x1
     bInterfaceProtocol :    0x1
     iInterface         :    0x0
      ENDPOINT 0x81: Interrupt IN ==========================
       bLength          :    0x7 (7 bytes)
       bDescriptorType  :    0x5 Endpoint
       bEndpointAddress :   0x81 IN
       bmAttributes     :    0x3 Interrupt
       wMaxPacketSize   :    0x8 (8 bytes)
       bInterval        :    0x4
    INTERFACE 1: Human Interface Device ====================
     bLength            :    0x9 (9 bytes)
     bDescriptorType    :    0x4 Interface
     bInterfaceNumber   :    0x1
     bAlternateSetting  :    0x0
     bNumEndpoints      :    0x1
     bInterfaceClass    :    0x3 Human Interface Device
     bInterfaceSubClass :    0x1
     bInterfaceProtocol :    0x2
     iInterface         :    0x0
      ENDPOINT 0x82: Interrupt IN ==========================
       bLength          :    0x7 (7 bytes)
       bDescriptorType  :    0x5 Endpoint
       bEndpointAddress :   0x82 IN
       bmAttributes     :    0x3 Interrupt
       wMaxPacketSize   :    0x8 (8 bytes)
       bInterval        :    0x2

DEVICE ID 1022:15e0 on Bus 002 Address 000 =================
 bLength                :   0x12 (18 bytes)
 bDescriptorType        :    0x1 Device
 bcdUSB                 :  0x300 USB 3.0
 bDeviceClass           :    0x9 Hub
 bDeviceSubClass        :    0x0
 bDeviceProtocol        :    0x3
 bMaxPacketSize0        :    0x9 (9 bytes)
 idVendor               : 0x1022
 idProduct              : 0x15e0
 bcdDevice              :  0x100 Device 1.0
 iManufacturer          :    0x0
 iProduct               :    0x0
 iSerialNumber          :    0x0
 bNumConfigurations     :    0x1
  CONFIGURATION 1: 0 mA ====================================
   bLength              :    0x9 (9 bytes)
   bDescriptorType      :    0x2 Configuration
   wTotalLength         :   0x1f (31 bytes)
   bNumInterfaces       :    0x1
   bConfigurationValue  :    0x1
   iConfiguration       :    0x0
   bmAttributes         :   0xc0 Self Powered
   bMaxPower            :    0x0 (0 mA)
    INTERFACE 0: Hub =======================================
     bLength            :    0x9 (9 bytes)
     bDescriptorType    :    0x4 Interface
     bInterfaceNumber   :    0x0
     bAlternateSetting  :    0x0
     bNumEndpoints      :    0x1
     bInterfaceClass    :    0x9 Hub
     bInterfaceSubClass :    0x0
     bInterfaceProtocol :    0x0
     iInterface         :    0x0
      ENDPOINT 0x81: Interrupt IN ==========================
       bLength          :    0x7 (7 bytes)
       bDescriptorType  :    0x5 Endpoint
       bEndpointAddress :   0x81 IN
       bmAttributes     :    0x3 Interrupt
       wMaxPacketSize   :    0x1 (1 bytes)
       bInterval        :    0xc

DEVICE ID 1022:15e1 on Bus 001 Address 000 =================
 bLength                :   0x12 (18 bytes)
 bDescriptorType        :    0x1 Device
 bcdUSB                 :  0x300 USB 3.0
 bDeviceClass           :    0x9 Hub
 bDeviceSubClass        :    0x0
 bDeviceProtocol        :    0x3
 bMaxPacketSize0        :    0x9 (9 bytes)
 idVendor               : 0x1022
 idProduct              : 0x15e1
 bcdDevice              :  0x100 Device 1.0
 iManufacturer          :    0x0
 iProduct               :    0x0
 iSerialNumber          :    0x0
 bNumConfigurations     :    0x1
  CONFIGURATION 1: 0 mA ====================================
   bLength              :    0x9 (9 bytes)
   bDescriptorType      :    0x2 Configuration
   wTotalLength         :   0x1f (31 bytes)
   bNumInterfaces       :    0x1
   bConfigurationValue  :    0x1
   iConfiguration       :    0x0
   bmAttributes         :   0xc0 Self Powered
   bMaxPower            :    0x0 (0 mA)
    INTERFACE 0: Hub =======================================
     bLength            :    0x9 (9 bytes)
     bDescriptorType    :    0x4 Interface
     bInterfaceNumber   :    0x0
     bAlternateSetting  :    0x0
     bNumEndpoints      :    0x1
     bInterfaceClass    :    0x9 Hub
     bInterfaceSubClass :    0x0
     bInterfaceProtocol :    0x0
     iInterface         :    0x0
      ENDPOINT 0x81: Interrupt IN ==========================
       bLength          :    0x7 (7 bytes)
       bDescriptorType  :    0x5 Endpoint
       bEndpointAddress :   0x81 IN
       bmAttributes     :    0x3 Interrupt
       wMaxPacketSize   :    0x1 (1 bytes)
       bInterval        :    0xc

DEVICE ID 0416:5011 on Bus 003 Address 002 =================
 bLength                :   0x12 (18 bytes)
 bDescriptorType        :    0x1 Device
 bcdUSB                 :  0x110 USB 1.1
 bDeviceClass           :    0x2 Communications Device
 bDeviceSubClass        :    0x0
 bDeviceProtocol        :    0x0
 bMaxPacketSize0        :   0x40 (64 bytes)
 idVendor               : 0x0416
 idProduct              : 0x5011
 bcdDevice              :  0x300 Device 3.0
 iManufacturer          :    0x1 Error Accessing String
 iProduct               :    0x2 Error Accessing String
 iSerialNumber          :    0x3 Error Accessing String
 bNumConfigurations     :    0x1
  CONFIGURATION 1: 100 mA ==================================
   bLength              :    0x9 (9 bytes)
   bDescriptorType      :    0x2 Configuration
   wTotalLength         :   0x43 (67 bytes)
   bNumInterfaces       :    0x2
   bConfigurationValue  :    0x1
   iConfiguration       :    0x0
   bmAttributes         :   0xc0 Self Powered
   bMaxPower            :   0x32 (100 mA)
    INTERFACE 0: CDC Communication =========================
     bLength            :    0x9 (9 bytes)
     bDescriptorType    :    0x4 Interface
     bInterfaceNumber   :    0x0
     bAlternateSetting  :    0x0
     bNumEndpoints      :    0x1
     bInterfaceClass    :    0x2 CDC Communication
     bInterfaceSubClass :    0x2
     bInterfaceProtocol :    0x1
     iInterface         :    0x0
      ENDPOINT 0x83: Interrupt IN ==========================
       bLength          :    0x7 (7 bytes)
       bDescriptorType  :    0x5 Endpoint
       bEndpointAddress :   0x83 IN
       bmAttributes     :    0x3 Interrupt
       wMaxPacketSize   :    0x8 (8 bytes)
       bInterval        :    0x1
    INTERFACE 1: CDC Data ==================================
     bLength            :    0x9 (9 bytes)
     bDescriptorType    :    0x4 Interface
     bInterfaceNumber   :    0x1
     bAlternateSetting  :    0x0
     bNumEndpoints      :    0x2
     bInterfaceClass    :    0xa CDC Data
     bInterfaceSubClass :    0x0
     bInterfaceProtocol :    0x0
     iInterface         :    0x0
      ENDPOINT 0x81: Bulk IN ===============================
       bLength          :    0x7 (7 bytes)
       bDescriptorType  :    0x5 Endpoint
       bEndpointAddress :   0x81 IN
       bmAttributes     :    0x2 Bulk
       wMaxPacketSize   :   0x40 (64 bytes)
       bInterval        :    0x0
      ENDPOINT 0x2: Bulk OUT ===============================
       bLength          :    0x7 (7 bytes)
       bDescriptorType  :    0x5 Endpoint
       bEndpointAddress :    0x2 OUT
       bmAttributes     :    0x2 Bulk
       wMaxPacketSize   :   0x40 (64 bytes)
       bInterval        :    0x0

DEVICE ID 1022:43bc on Bus 003 Address 000 =================
 bLength                :   0x12 (18 bytes)
 bDescriptorType        :    0x1 Device
 bcdUSB                 :  0x300 USB 3.0
 bDeviceClass           :    0x9 Hub
 bDeviceSubClass        :    0x0
 bDeviceProtocol        :    0x3
 bMaxPacketSize0        :    0x9 (9 bytes)
 idVendor               : 0x1022
 idProduct              : 0x43bc
 bcdDevice              :  0x100 Device 1.0
 iManufacturer          :    0x0
 iProduct               :    0x0
 iSerialNumber          :    0x0
 bNumConfigurations     :    0x1
  CONFIGURATION 1: 0 mA ====================================
   bLength              :    0x9 (9 bytes)
   bDescriptorType      :    0x2 Configuration
   wTotalLength         :   0x1f (31 bytes)
   bNumInterfaces       :    0x1
   bConfigurationValue  :    0x1
   iConfiguration       :    0x0
   bmAttributes         :   0xc0 Self Powered
   bMaxPower            :    0x0 (0 mA)
    INTERFACE 0: Hub =======================================
     bLength            :    0x9 (9 bytes)
     bDescriptorType    :    0x4 Interface
     bInterfaceNumber   :    0x0
     bAlternateSetting  :    0x0
     bNumEndpoints      :    0x1
     bInterfaceClass    :    0x9 Hub
     bInterfaceSubClass :    0x0
     bInterfaceProtocol :    0x0
     iInterface         :    0x0
      ENDPOINT 0x81: Interrupt IN ==========================
       bLength          :    0x7 (7 bytes)
       bDescriptorType  :    0x5 Endpoint
       bEndpointAddress :   0x81 IN
       bmAttributes     :    0x3 Interrupt
       wMaxPacketSize   :    0x2 (2 bytes)
       bInterval        :    0xc

DEVICE ID 1a86:e008 on Bus 003 Address 004 =================
 bLength                :   0x12 (18 bytes)
 bDescriptorType        :    0x1 Device
 bcdUSB                 :  0x100 USB 1.0
 bDeviceClass           :    0x0 Specified at interface
 bDeviceSubClass        :    0x0
 bDeviceProtocol        :    0x0
 bMaxPacketSize0        :    0x8 (8 bytes)
 idVendor               : 0x1a86
 idProduct              : 0xe008
 bcdDevice              : 0x1200 Device 18.0
 iManufacturer          :    0x1 WCH.CN ↕
 iProduct               :    0x2 USB to Serial
 iSerialNumber          :    0x0
 bNumConfigurations     :    0x1
  CONFIGURATION 1: 100 mA ==================================
   bLength              :    0x9 (9 bytes)
   bDescriptorType      :    0x2 Configuration
   wTotalLength         :   0x29 (41 bytes)
   bNumInterfaces       :    0x1
   bConfigurationValue  :    0x1
   iConfiguration       :    0x4 Error Accessing String
   bmAttributes         :   0x80 Bus Powered
   bMaxPower            :   0x32 (100 mA)
    INTERFACE 0: Human Interface Device ====================
     bLength            :    0x9 (9 bytes)
     bDescriptorType    :    0x4 Interface
     bInterfaceNumber   :    0x0
     bAlternateSetting  :    0x0
     bNumEndpoints      :    0x2
     bInterfaceClass    :    0x3 Human Interface Device
     bInterfaceSubClass :    0x0
     bInterfaceProtocol :    0x0
     iInterface         :    0x0
      ENDPOINT 0x82: Interrupt IN ==========================
       bLength          :    0x7 (7 bytes)
       bDescriptorType  :    0x5 Endpoint
       bEndpointAddress :   0x82 IN
       bmAttributes     :    0x3 Interrupt
       wMaxPacketSize   :    0x8 (8 bytes)
       bInterval        :    0x5
      ENDPOINT 0x2: Interrupt OUT ==========================
       bLength          :    0x7 (7 bytes)
       bDescriptorType  :    0x5 Endpoint
       bEndpointAddress :    0x2 OUT
       bmAttributes     :    0x3 Interrupt
       wMaxPacketSize   :    0x8 (8 bytes)
       bInterval        :    0x5

DEVICE ID 1a86:e008 on Bus 003 Address 003 =================
 bLength                :   0x12 (18 bytes)
 bDescriptorType        :    0x1 Device
 bcdUSB                 :  0x100 USB 1.0
 bDeviceClass           :    0x0 Specified at interface
 bDeviceSubClass        :    0x0
 bDeviceProtocol        :    0x0
 bMaxPacketSize0        :    0x8 (8 bytes)
 idVendor               : 0x1a86
 idProduct              : 0xe008
 bcdDevice              : 0x1400 Device 20.0
 iManufacturer          :    0x1 WCH.CN ¶
 iProduct               :    0x2 USB to Serial
 iSerialNumber          :    0x0
 bNumConfigurations     :    0x1
  CONFIGURATION 1: 100 mA ==================================
   bLength              :    0x9 (9 bytes)
   bDescriptorType      :    0x2 Configuration
   wTotalLength         :   0x29 (41 bytes)
   bNumInterfaces       :    0x1
   bConfigurationValue  :    0x1
   iConfiguration       :    0x4 Error Accessing String
   bmAttributes         :   0x80 Bus Powered
   bMaxPower            :   0x32 (100 mA)
    INTERFACE 0: Human Interface Device ====================
     bLength            :    0x9 (9 bytes)
     bDescriptorType    :    0x4 Interface
     bInterfaceNumber   :    0x0
     bAlternateSetting  :    0x0
     bNumEndpoints      :    0x2
     bInterfaceClass    :    0x3 Human Interface Device
     bInterfaceSubClass :    0x0
     bInterfaceProtocol :    0x0
     iInterface         :    0x0
      ENDPOINT 0x82: Interrupt IN ==========================
       bLength          :    0x7 (7 bytes)
       bDescriptorType  :    0x5 Endpoint
       bEndpointAddress :   0x82 IN
       bmAttributes     :    0x3 Interrupt
       wMaxPacketSize   :    0x8 (8 bytes)
       bInterval        :    0x5
      ENDPOINT 0x2: Interrupt OUT ==========================
       bLength          :    0x7 (7 bytes)
       bDescriptorType  :    0x5 Endpoint
       bEndpointAddress :    0x2 OUT
       bmAttributes     :    0x3 Interrupt
       wMaxPacketSize   :    0x8 (8 bytes)
       bInterval        :    0x5